{
  "ablation_localization_pass_count": 110,
  "admission_gate_changed": false,
  "applicable_ablation_candidate_count": 110,
  "applicable_candidate_role_counts": {
    "context": 8,
    "contradiction": 4,
    "decision_record": 26,
    "derivative": 7,
    "source": 65
  },
  "baseline_model_runs_started": false,
  "benchmark_evidence_claimed": false,
  "board_admitted_count": 0,
  "board_id": "adds-frontier-private-pilot-v1",
  "canonical_stage_count": 60,
  "challenge_assignment_authorized": false,
  "compiled_on": "2026-08-23",
  "curation_id": "adds-frontier-oracle-support-curation-v1",
  "curation_packets_ready_for_human_review": true,
  "expert_solve_gate_changed": false,
  "human_curation_required": true,
  "human_decision_count": 0,
  "human_review_assignment_count": 0,
  "integrity_sha256": "9c82d437f6c5b4b28395e41498f50d50278dd9c2cd3a14bee80aa25e6149d65e",
  "lineage_redundancy_candidate_count": 14,
  "machine_ablation_localization_ready": true,
  "nonapplicable_ablation_candidate_count": 20,
  "nonclaims": [
    "A leave-one-out candidate is a review workload item, not a recommendation to remove evidence.",
    "Evidence roles and repeated lineages prioritize inspection but do not establish relevance or independence.",
    "Exact scorer rejection reflects the frozen author-oracle witness set, not scientific necessity.",
    "Machine-generated packets cannot revise author oracles or satisfy human curation gates.",
    "No challenge assignment, model run, benchmark result, or board admission is authorized.",
    "No private task, oracle, evidence identity, lineage identity, stage record, or candidate payload is public."
  ],
  "oracle_revision_applied": false,
  "oracle_support_ready_for_independent_challenge": false,
  "planned_ablation_candidate_count": 130,
  "private_packet_set_commitment": "c0aac771aba980ab6361723c5ba5373096de656243dec045261dc4cad0080495",
  "private_payload_published": false,
  "protected_singleton_candidate_count": 20,
  "protocol_id": "adds-frontier-v1",
  "public_fragility_summary_integrity_sha256": "288567c43036fb4f4d3ab93edd9388fa3ec13d27c683e64e9ee467032708fa31",
  "public_preflight_integrity_sha256": "9e195e7a5e7ccfeefca8b195202354262901fe93778fbf4085cecf55ba5a2027",
  "repeated_lineage_group_count": 7,
  "review_priority_rule": "repeated_lineage_members_before_other_witness_saturation_candidates",
  "schema_version": "adds.frontier-oracle-support-curation-summary.v1",
  "scientific_minimality_established": false,
  "status": "machine_packets_ready_human_curation_unassigned",
  "support_ablation_rule": "leave_one_witness_out_only_when_at_least_one_witness_remains",
  "support_selectivity_candidate_count": 96,
  "task_packet_count": 10,
  "witness_occurrence_role_counts": {
    "context": 8,
    "contradiction": 4,
    "decision_record": 26,
    "derivative": 7,
    "source": 85
  },
  "witness_saturated_stage_count": 60
}
